{
  "$schema": "https://json-schema.org/draft/2020-12/schema",
  "$id": "https://xiaoban.local/schema/practice-preset-shard.schema.json",
  "title": "Xiaoban Practice Grade Subject Shard",
  "type": "object",
  "additionalProperties": false,
  "required": ["schemaVersion", "grade", "subject", "papers"],
  "properties": {
    "schemaVersion": { "const": 1 },
    "grade": { "enum": ["G1", "G2", "G3", "G4", "G5", "G6"] },
    "subject": { "enum": ["CHINESE", "MATH", "ENGLISH"] },
    "papers": {
      "type": "array",
      "minItems": 1,
      "items": { "$ref": "#/$defs/paper" }
    }
  },
  "$defs": {
    "paper": {
      "type": "object",
      "additionalProperties": false,
      "required": [
        "id", "version", "grade", "subject", "semester", "title", "description",
        "difficulty", "questionCount", "estimatedMinutes", "tags", "sourceType", "status", "questions"
      ],
      "properties": {
        "id": { "type": "string", "minLength": 1 },
        "version": { "type": "integer", "minimum": 1 },
        "grade": { "enum": ["G1", "G2", "G3", "G4", "G5", "G6"] },
        "subject": { "enum": ["CHINESE", "MATH", "ENGLISH", "THINKING"] },
        "semester": { "enum": ["ALL", "S1", "S2"] },
        "title": { "type": "string", "minLength": 1 },
        "description": { "type": "string", "minLength": 1 },
        "difficulty": { "enum": ["L1", "L2", "L3"] },
        "questionCount": { "type": "integer", "minimum": 5, "maximum": 50 },
        "estimatedMinutes": { "type": "integer", "minimum": 1, "maximum": 120 },
        "tags": {
          "type": "array",
          "minItems": 1,
          "maxItems": 8,
          "uniqueItems": true,
          "items": { "type": "string", "minLength": 1 }
        },
        "sourceType": { "enum": ["PRESET", "AI_GENERATED", "PARENT_CREATED", "IMPORTED"] },
        "status": { "enum": ["PUBLISHED", "ARCHIVED"] },
        "questions": {
          "type": "array",
          "minItems": 5,
          "maxItems": 50,
          "items": { "$ref": "#/$defs/question" }
        }
      }
    },
    "question": {
      "type": "object",
      "additionalProperties": false,
      "required": [
        "id", "orderNo", "type", "stem", "options", "answerSpec",
        "explanation", "hints", "tags"
      ],
      "properties": {
        "id": { "type": "string", "minLength": 1 },
        "orderNo": { "type": "integer", "minimum": 1 },
        "type": {
          "enum": ["SINGLE_CHOICE", "MULTIPLE_CHOICE", "FILL_BLANK", "NUMBER", "SHORT_TEXT"]
        },
        "stem": { "type": "string", "minLength": 1 },
        "options": {
          "type": "array",
          "maxItems": 6,
          "items": { "$ref": "#/$defs/option" }
        },
        "answerSpec": { "type": "string", "minLength": 1 },
        "explanation": { "type": "string", "minLength": 1 },
        "hints": {
          "type": "array",
          "minItems": 1,
          "maxItems": 3,
          "uniqueItems": true,
          "items": { "type": "string", "minLength": 1 }
        },
        "tags": {
          "type": "array",
          "minItems": 1,
          "maxItems": 8,
          "uniqueItems": true,
          "items": { "type": "string", "minLength": 1 }
        }
      }
    },
    "option": {
      "type": "object",
      "additionalProperties": false,
      "required": ["key", "label"],
      "properties": {
        "key": { "type": "string", "minLength": 1 },
        "label": { "type": "string", "minLength": 1 }
      }
    }
  }
}
